{
  "claim": "Component X is essential to the detector's warning advantage.",
  "component": "X",
  "baseline_value": 16.5,
  "ablated_value": 16.2,
  "metric": "paired_median_gain",
  "higher_is_better": true,
  "epsilon": 1.0,
  "contributory_fraction": 0.25,
  "ablation": "replace X with matched conventional substitute",
  "preserved_conditions": [
    "same data",
    "same seeds",
    "same false-positive constraint",
    "same compute budget"
  ],
  "violations": [],
  "pre_registered": true,
  "proxy_leakage": false,
  "claim_type": "necessity"
}