{
  "claim": "Component X is essential to system performance.",
  "component": "X",
  "baseline_value": 100.0,
  "ablated_value": 10.0,
  "metric": "performance",
  "higher_is_better": true,
  "epsilon": 2.0,
  "contributory_fraction": 0.25,
  "ablation": "remove X",
  "preserved_conditions": [
    "same data",
    "same seed",
    "same evaluator"
  ],
  "violations": [],
  "pre_registered": true,
  "proxy_leakage": false,
  "claim_type": "necessity"
}